{
  "contract": "pet_generation_v2.animation_prompt_catalog.v1",
  "version": 47,
  "model": "handwritten",
  "prefix": "The character in the picture moves with the body it actually has.",
  "suffix": "It floats free with nothing beneath it. Motion is continuous; the body stays whole. Keep every limb and carried thing in the central seventy percent, with fifteen percent empty margin on every side. Loose parts follow and settle. Only named things appear, drift in when needed and leave by the end. Keep the flat background unchanged. Preserve soft neutral diffuse lighting, fixed exposure, white balance and material roughness, including loop seams. No glossy hotspots, clipped highlights, bloom or flickering glow. The camera does not move.",
  "entries": [
    {
      "id": "idle",
      "availability": "enabled",
      "template": "It settles into a habit it knows by heart, works through it, and begins again. Easy and unhurried.",
      "duration_seconds": 6,
      "source_hash": "f6aef395a69370c17db0be4f5472e33fc9a1b601bebd50186999c2249bf60203",
      "verified": {
        "verdict": "pending_verification"
      }
    },
    {
      "id": "rest",
      "availability": "enabled",
      "template": "It lets its tension go and hangs loose, drifting gently, still awake. Slow and unwinding.",
      "duration_seconds": 6,
      "source_hash": "2cd1c80d0a54cec16efc9fa35650f5c0b2911d965ff461ac0881fff7de02e070",
      "verified": {
        "verdict": "pending_verification"
      }
    },
    {
      "id": "sleep",
      "availability": "enabled",
      "template": "It is fast asleep. Only its slow breathing moves it, in and out, the whole time. Very slow.",
      "duration_seconds": 6,
      "source_hash": "7835e185daeae3954de61f352316f6bb1ff202f6b512cd3693d1c4cbf8366f93",
      "verified": {
        "verdict": "pending_verification"
      }
    },
    {
      "id": "thinking",
      "availability": "enabled",
      "template": "It is weighing something up. It leans slowly over to one side as if that were the answer, then just as slowly over to the other, unable to settle on either. Slow and absorbed.",
      "duration_seconds": 6,
      "source_hash": "bb09a88be126148ffc2a88ac3374a92839c3e99361e06f3a464591e848b38748",
      "verified": {
        "verdict": "pending_verification"
      }
    },
    {
      "id": "at_glass",
      "availability": "enabled",
      "template": "It leans into the empty air right in front of it as if it will not give, pushes, works its way sideways, and pushes again. Steady and patient.",
      "duration_seconds": 6,
      "source_hash": "6e92fd0165b269c0851e56ddc2cf8f2154d0b15a58e16d0f05310e6c38fb0292",
      "verified": {
        "verdict": "pending_verification"
      }
    },
    {
      "id": "watching",
      "availability": "enabled",
      "template": "It is searching for something out beyond the picture. It looks hard to one side, then brings the front of its body across to look just as hard the other way, checking each direction before moving on. Alert and intent.",
      "duration_seconds": 6,
      "source_hash": "84b9821cb43a8ff46d6892fc1244d6303237ac6fc557973f12f99136951be776",
      "verified": {
        "verdict": "pending_verification"
      }
    },
    {
      "id": "work",
      "availability": "disabled",
      "template": "It settles into whatever position suits typing best, then works a keyboard in front of it, hitting it hard and fast with its whole body, glancing at what comes out and driving straight back in. Quick and tireless.",
      "duration_seconds": 8,
      "source_hash": "879f4c1986b0cddbfb696d8b02a8fd92bdf5ea0e36a08943901e6eb88d1b76cd",
      "verified": {
        "verdict": "rejected",
        "job": "YFlD2skekksYnHadUvqM",
        "date": "2026-09-09T17:29:10.088Z",
        "framing_qa": {
          "contract": "pet_generation_v2.framing_qa.v1",
          "duration_seconds": 8.041667,
          "sampled_frames": [
            {
              "index": 0,
              "seek_seconds": 0,
              "component_count": 2,
              "bbox": {
                "left": 232,
                "top": 158,
                "right": 727,
                "bottom": 801,
                "pixel_width": 496,
                "pixel_height": 644,
                "width_ratio": 0.5166666666666667,
                "height_ratio": 0.6708333333333333,
                "margins": {
                  "left": 0.24166666666666667,
                  "top": 0.16458333333333333,
                  "right": 0.24166666666666667,
                  "bottom": 0.16458333333333333
                }
              }
            },
            {
              "index": 1,
              "seek_seconds": 0.041666666666666664,
              "component_count": 2,
              "bbox": {
                "left": 231,
                "top": 158,
                "right": 727,
                "bottom": 801,
                "pixel_width": 497,
                "pixel_height": 644,
                "width_ratio": 0.5177083333333333,
                "height_ratio": 0.6708333333333333,
                "margins": {
                  "left": 0.240625,
                  "top": 0.16458333333333333,
                  "right": 0.24166666666666667,
                  "bottom": 0.16458333333333333
                }
              }
            },
            {
              "index": 2,
              "seek_seconds": 0.08333333333333333,
              "component_count": 2,
              "bbox": {
                "left": 231,
                "top": 158,
                "right": 727,
                "bottom": 801,
                "pixel_width": 497,
                "pixel_height": 644,
                "width_ratio": 0.5177083333333333,
                "height_ratio": 0.6708333333333333,
                "margins": {
                  "left": 0.240625,
                  "top": 0.16458333333333333,
                  "right": 0.24166666666666667,
                  "bottom": 0.16458333333333333
                }
              }
            },
            {
              "index": 3,
              "seek_seconds": 0.125,
              "component_count": 2,
              "bbox": {
                "left": 230,
                "top": 158,
                "right": 727,
                "bottom": 801,
                "pixel_width": 498,
                "pixel_height": 644,
                "width_ratio": 0.51875,
                "height_ratio": 0.6708333333333333,
                "margins": {
                  "left": 0.23958333333333334,
                  "top": 0.16458333333333333,
                  "right": 0.24166666666666667,
                  "bottom": 0.16458333333333333
                }
              }
            },
            {
              "index": 4,
              "seek_seconds": 0.16666666666666666,
              "component_count": 2,
              "bbox": {
                "left": 230,
                "top": 158,
                "right": 727,
                "bottom": 801,
                "pixel_width": 498,
                "pixel_height": 644,
                "width_ratio": 0.51875,
                "height_ratio": 0.6708333333333333,
                "margins": {
                  "left": 0.23958333333333334,
                  "top": 0.16458333333333333,
                  "right": 0.24166666666666667,
                  "bottom": 0.16458333333333333
                }
              }
            },
            {
              "index": 5,
              "seek_seconds": 0.20833333333333334,
              "component_count": 2,
              "bbox": {
                "left": 230,
                "top": 158,
                "right": 727,
                "bottom": 803,
                "pixel_width": 498,
                "pixel_height": 646,
                "width_ratio": 0.51875,
                "height_ratio": 0.6729166666666667,
                "margins": {
                  "left": 0.23958333333333334,
                  "top": 0.16458333333333333,
                  "right": 0.24166666666666667,
                  "bottom": 0.1625
                }
              }
            },
            {
              "index": 6,
              "seek_seconds": 0.25,
              "component_count": 2,
              "bbox": {
                "left": 230,
                "top": 158,
                "right": 727,
                "bottom": 803,
                "pixel_width": 498,
                "pixel_height": 646,
                "width_ratio": 0.51875,
                "height_ratio": 0.6729166666666667,
                "margins": {
                  "left": 0.23958333333333334,
                  "top": 0.16458333333333333,
                  "right": 0.24166666666666667,
                  "bottom": 0.1625
                }
              }
            },
            {
              "index": 7,
              "seek_seconds": 0.2916666666666667,
              "component_count": 2,
              "bbox": {
                "left": 230,
                "top": 158,
                "right": 727,
                "bottom": 803,
                "pixel_width": 498,
                "pixel_height": 646,
                "width_ratio": 0.51875,
                "height_ratio": 0.6729166666666667,
                "margins": {
                  "left": 0.23958333333333334,
                  "top": 0.16458333333333333,
                  "right": 0.24166666666666667,
                  "bottom": 0.1625
                }
              }
            },
            {
              "index": 8,
              "seek_seconds": 0.3333333333333333,
              "component_count": 2,
              "bbox": {
                "left": 230,
                "top": 158,
                "right": 727,
                "bottom": 803,
                "pixel_width": 498,
                "pixel_height": 646,
                "width_ratio": 0.51875,
                "height_ratio": 0.6729166666666667,
                "margins": {
                  "left": 0.23958333333333334,